german word	german sentence	english translation
der Boden(1)	Die Bücher lagen alle auf dem Boden.	The books were all on the floor.
der Boden(2)	Auf diesem Boden wächst Gemüse besonders gut.	Vegetables grow particularly well on this soil.
der Bogen(1)	Bitte schreiben Sie Ihren Namen auf den Antwortbogen.	Please write your name on the response sheet.
die Bohne(1)	Ich esse gern Bohnen.	I like to eat beans.
das Boot(1)	An diesem See kann man Boote mieten.	You can rent boats at this lake.
die Botschaft(1)	Das Visum habe ich von der Botschaft erhalten.	I received the visa from the embassy.
der Brief(1)	Ich schreibe nicht gern Briefe.	I don't like writing letters.
der Briefkasten(1)	Ist hier in der Nähe ein Briefkasten?	Is there a mailbox nearby?
der Briefkasten(2)	Hol bitte mal die Zeitung aus dem Briefkasten.	Please get the newspaper out of the mailbox.
die Briefmarke(1)	Briefmarken bekommen Sie am Schalter 7.	You can get stamps at counter 7.
der Briefträger(1)	War die Briefträgerin schon da?	Has the mail carrier already been here?
böse(1)	Ich habe das Buch leider vergessen. Hoffentlich bist du mir nicht böse.	I unfortunately forgot the book. I hope you’re not angry with me.
böse(2)	Mach nicht so ein böses Gesicht!	Don’t make such an angry face!
böse(3)	Ich bin böse auf dich, du bist wieder nicht gekommen!	I’m angry with you; you didn’t come again!
böse(4)	Zeig mal! Du hast dich verletzt? Das sieht aber böse aus.	Let me see! You injured yourself? That looks pretty bad.
braten(1)	Das Fleisch muss zehn Minuten braten.	The meat needs to roast for ten minutes.
braten(2)	Heute gibt’s gebratenen Fisch.	Today we have fried fish.
der Braten(1)	Der Braten ist sehr saftig.	The roast is very juicy.
der Briefumschlag(1)	Ich hätte gern 50 Briefumschläge und Briefmarken dazu.	I would like 50 envelopes and stamps to go with that.
die Brieftasche(1)	Ich habe nur Kleingeld in meiner Brieftasche.	I only have small change in my wallet.
die Brille(1)	Ich brauche eine neue Brille.	I need a new pair of glasses.
bringen(1)	Bringen Sie mir bitte ein Glas Tee!	Please bring me a glass of tea!
bringen(2)	Ich bringe dich nach Hause.	I will take you home.
bringen(3)	Die Abendzeitung hat einen Bericht über den Unfall gebracht.	The evening newspaper brought a report about the accident.
bringen(4)	Nehmen Sie noch etwas Soße zum Braten?	Would you like some more sauce for the roast?
brauchen(1)	Ich brauche ein Auto.	I need a car.
brauchen(2)	Brauchst du die Zeitung noch?	Do you still need the newspaper?
brauchen(3)	Meine Großmutter ist krank. Sie braucht viel Ruhe.	My grandmother is sick. She needs a lot of rest.
brauchen(4)	Ich habe für die Renovierung eine Woche gebraucht.	I needed a week for the renovation.
brauchen(5)	Sie brauchen morgen nicht zu kommen. Ich schaffe das alleine.	You don’t need to come tomorrow. I can handle it alone.
die Broschüre(1)	In der Broschüre finden Sie die neuesten Informationen.	In the brochure, you will find the latest information.
das Brot(1)	Brot kaufe ich immer beim Bäcker, nicht im Supermarkt.	I always buy bread from the baker, not at the supermarket.
das Brot(2)	Was möchtest du aufs Brot haben?	What would you like on your bread?
das Brot(3)	Nimm noch ein paar belegte Brote für die Fahrt mit.	Take a few more sandwiches for the trip.
brechen(1)	Er hat sich beim Skifahren verletzt, sein Bein ist gebrochen.	He injured himself skiing; his leg is broken.
brechen(2)	Ich habe mir im Urlaub das Bein gebrochen.	I broke my leg on vacation.
breit(1)	Der Teppich ist zwei Meter lang und einen Meter breit.	The carpet is two meters long and one meter wide.
die Breite(1)	Welche Maße hat der Tisch? – Länge: 1 m, Breite: 80 cm, Höhe: 1,20 m.	What are the dimensions of the table? – Length: 1 m, width: 80 cm, height: 1.20 m.
bremsen(1)	Der Mann ist ganz plötzlich über die Straße gegangen. Ich musste stark bremsen.	The man suddenly walked across the street. I had to brake hard.
die Bremse(1)	Du musst unbedingt die Bremsen kontrollieren lassen.	You definitely need to have the brakes checked.
brennen(1)	In diesem Haus hat es letztes Jahr gebrannt.	There was a fire in this house last year.
brennen(2)	Die Kerze brennt noch. Mach sie bitte aus.	The candle is still burning. Please put it out.
brennen(3)	In deinem Zimmer hat die ganze Nacht das Licht gebrannt.	The light in your room has been on all night.
das Brötchen(1)	Ich hole schnell ein paar Brötchen zum Frühstück.	I’ll quickly get a few rolls for breakfast.
das Brötli(1)	Ich hole schnell ein paar Brötli zum Frühstück.	I’ll quickly get a few rolls for breakfast.
die Brücke(1)	Fahren Sie über die nächste Brücke und dann rechts.	Drive over the next bridge and then turn right.
der Bruder(1)	Mein jüngster Bruder geht noch zur Schule.	My youngest brother is still in school.
die Brust(1)	Ich habe Schmerzen in der Brust.	I have pain in my chest.
der Bub(1)	In der Schulklasse sind 15 Buben und 10 Mädchen.	In the class are 15 boys and 10 girls.
das Buch(1)	Haben Sie ein Buch über die Geschichte von Berlin?	Do you have a book about the history of Berlin?
die Buchhandlung(1)	In der Buchhandlung in der Stadt haben sie das Buch sicher.	In the bookstore in the city, they surely have the book.
buchen(1)	Ich habe für morgen einen Flug nach Rom gebucht.	I booked a flight to Rome for tomorrow.
buchstabieren(1)	Würden Sie Ihren Namen bitte buchstabieren?	Could you please spell your name?
der Buchstabe(1)	Gibt es diesen Buchstaben auch in deiner Muttersprache?	Is there this letter in your native language?
der Buchstabe(2)	Ihr Name beginnt mit K. – Buchstabe K ist in Zimmer 3. Bitte warten Sie dort.	Your name starts with K. – Letter K is in room 3. Please wait there.
die Büchse(1)	Ich habe noch eine Büchse Bohnen.	I still have a can of beans.
das Buffet(1)	Das Buffet ist eröffnet!	The buffet is open!
die Bühne(1)	Er steht gern auf der Bühne.	He likes to be on stage.
bunt(1)	Das bunte Kleid gefällt mir gut.	I like the colorful dress.
die Burg(1)	Von der Burg hat man eine schöne Aussicht.	From the castle, there is a beautiful view.
der Bürger(1)	EU-Bürgerinnen und Bürger können überall in Europa arbeiten.	EU citizens can work anywhere in Europe.
die Bürgerin(1)	EU-Bürgerinnen und Bürger können überall in Europa arbeiten.	EU citizens can work anywhere in Europe.
das Büro(1)	Unser Büro bleibt samstags geschlossen.	Our office is closed on Saturdays.
das Büro(2)	Ich möchte in einem Büro arbeiten.	I would like to work in an office.
die Bürste(1)	Hast du eine Bürste? Meine Schuhe sind so schmutzig.	Do you have a brush? My shoes are so dirty.
die Bürste(2)	Ich brauche eine Bürste für meine Haare.	I need a brush for my hair.
die Zahnbürste(1)	Ich brauche eine neue Zahnbürste.	I need a new toothbrush.
der Bus(1)	Ich fahre meistens mit dem Bus zur Arbeit.	I usually take the bus to work.
die Butter(1)	Ich möchte nur Butter aufs Brot.	I only want butter on the bread.
